configs/vllm_moe_tuning/w7900_awq_int4_m_only_v1/E=256,N=512,device_name=AMD_Radeon_PRO_W7900_Dual_Slot_,dtype=int4_w4a16.json
{
  "1": {
    "BLOCK_SIZE_M": 16,
    "GROUP_SIZE_M": 2,
    "SPLIT_K": 1,
    "num_warps": 4,
    "num_stages": 2
  },
  "2": {
    "BLOCK_SIZE_M": 16,
    "GROUP_SIZE_M": 2,
    "SPLIT_K": 1,
    "num_warps": 4,
    "num_stages": 2
  },
  "4": {
    "BLOCK_SIZE_M": 16,
    "GROUP_SIZE_M": 2,
    "SPLIT_K": 1,
    "num_warps": 4,
    "num_stages": 2
  },
  "8": {
    "BLOCK_SIZE_M": 16,
    "GROUP_SIZE_M": 2,
    "SPLIT_K": 1,
    "num_warps": 4,
    "num_stages": 2
  },
  "16": {
    "BLOCK_SIZE_M": 16,
    "GROUP_SIZE_M": 1,
    "SPLIT_K": 1,
    "num_warps": 4,
    "num_stages": 2
  },
  "24": {
    "BLOCK_SIZE_M": 16,
    "GROUP_SIZE_M": 1,
    "SPLIT_K": 1,
    "num_warps": 4,
    "num_stages": 2
  },
  "32": {
    "BLOCK_SIZE_M": 16,
    "GROUP_SIZE_M": 2,
    "SPLIT_K": 1,
    "num_warps": 4,
    "num_stages": 1
  },
  "48": {
    "BLOCK_SIZE_M": 16,
    "GROUP_SIZE_M": 1,
    "SPLIT_K": 1,
    "num_warps": 4,
    "num_stages": 2
  },
  "64": {
    "BLOCK_SIZE_M": 16,
    "GROUP_SIZE_M": 1,
    "SPLIT_K": 1,
    "num_warps": 4,
    "num_stages": 1
  },
  "96": {
    "BLOCK_SIZE_M": 16,
    "GROUP_SIZE_M": 1,
    "SPLIT_K": 1,
    "num_warps": 4,
    "num_stages": 1
  },
  "128": {
    "BLOCK_SIZE_M": 16,
    "GROUP_SIZE_M": 1,
    "SPLIT_K": 1,
    "num_warps": 4,
    "num_stages": 2
  },
  "256": {
    "BLOCK_SIZE_M": 16,
    "GROUP_SIZE_M": 1,
    "SPLIT_K": 1,
    "num_warps": 4,
    "num_stages": 2
  },
  "512": {
    "BLOCK_SIZE_M": 32,
    "GROUP_SIZE_M": 2,
    "SPLIT_K": 1,
    "num_warps": 4,
    "num_stages": 2
  },
  "1024": {
    "BLOCK_SIZE_M": 32,
    "GROUP_SIZE_M": 2,
    "SPLIT_K": 1,
    "num_warps": 4,
    "num_stages": 2
  },
  "1536": {
    "BLOCK_SIZE_M": 32,
    "GROUP_SIZE_M": 2,
    "SPLIT_K": 1,
    "num_warps": 4,
    "num_stages": 2
  },
  "2048": {
    "BLOCK_SIZE_M": 64,
    "GROUP_SIZE_M": 1,
    "SPLIT_K": 1,
    "num_warps": 4,
    "num_stages": 1
  },
  "3072": {
    "BLOCK_SIZE_M": 64,
    "GROUP_SIZE_M": 1,
    "SPLIT_K": 1,
    "num_warps": 4,
    "num_stages": 1
  },
  "4096": {
    "BLOCK_SIZE_M": 128,
    "GROUP_SIZE_M": 2,
    "SPLIT_K": 1,
    "num_warps": 4,
    "num_stages": 2
  },
  "8192": {
    "BLOCK_SIZE_M": 256,
    "GROUP_SIZE_M": 2,
    "SPLIT_K": 1,
    "num_warps": 8,
    "num_stages": 2
  }
}
